[
  {
    "id": "comp_001",
    "eval_type": "model_comparison",
    "task": "摘要质量对比",
    "prompt": "请总结以下新闻：\n\n科技巨头公司今天宣布推出新一代人工智能芯片，该芯片采用7纳米工艺，性能比上一代提升50%，能耗降低30%。这款芯片将主要应用于数据中心和边缘计算设备，预计将在明年第一季度开始量产。公司CEO表示，这是公司在AI领域的重要里程碑。",
    "expected_output": "科技公司发布新AI芯片，采用7nm工艺，性能提升50%，能耗降低30%，将用于数据中心和边缘计算，明年Q1量产。",
    "evaluation_criteria": {
      "metrics": ["rouge", "semantic_similarity", "human_eval"],
      "threshold": 0.7
    },
    "metadata": {
      "language": "zh",
      "domain": "文本摘要",
      "difficulty": "medium",
      "created_at": "2024-01-20T09:00:00Z",
      "version": "1.0",
      "tags": ["comparison", "summarization", "chinese"]
    }
  },
  {
    "id": "comp_002",
    "eval_type": "model_comparison",
    "task": "Sentiment Analysis Comparison",
    "prompt": "Analyze the sentiment of the following text: 'This product exceeded my expectations! The quality is outstanding and the customer service was very helpful.'",
    "expected_output": "Positive sentiment. The text expresses satisfaction with both product quality and customer service.",
    "evaluation_criteria": {
      "metrics": ["accuracy", "semantic_similarity"],
      "threshold": 0.8
    },
    "test_cases": [
      {
        "input": "This is the worst purchase I've ever made. Completely disappointed.",
        "expected": "Negative",
        "weight": 1.0
      },
      {
        "input": "The product is okay, nothing special but it works.",
        "expected": "Neutral",
        "weight": 1.0
      },
      {
        "input": "Absolutely love it! Best decision ever!",
        "expected": "Positive",
        "weight": 1.0
      }
    ],
    "metadata": {
      "language": "en",
      "domain": "sentiment_analysis",
      "difficulty": "easy",
      "created_at": "2024-01-21T11:00:00Z",
      "version": "1.0",
      "tags": ["comparison", "sentiment", "classification"]
    }
  }
]
